{
  "$schema": "https://json-schema.org/draft/2020-12/schema",
  "$id": "https://tds.internal/schemas/component.v1.json",
  "title": "TDS Component Contract v1",
  "description": "컴포넌트 4자 계약(Contract ↔ React ↔ Storybook ↔ Figma)의 단일 원천. 이 파일에서 React 타입, Storybook argTypes, Figma Properties, Docs가 자동 생성된다 (tools/codegen). G3 승인 시 Frozen.",
  "type": "object",
  "required": [
    "name",
    "version",
    "level",
    "category",
    "status",
    "owner",
    "props",
    "states",
    "tokens",
    "a11y"
  ],
  "additionalProperties": false,
  "properties": {
    "$schema": { "type": "string" },
    "name": {
      "type": "string",
      "pattern": "^[A-Z][A-Za-z0-9]*$",
      "description": "PascalCase 컴포넌트명"
    },
    "version": {
      "type": "string",
      "pattern": "^(0|[1-9]\\d*)\\.(0|[1-9]\\d*)\\.(0|[1-9]\\d*)(-[0-9A-Za-z.-]+)?$",
      "description": "SemVer. prop 제거/타입 변경/default 변경 → MAJOR, prop 추가 → MINOR"
    },
    "level": { "enum": ["atom", "molecule", "organism", "template", "page"] },
    "category": {
      "enum": [
        "Actions",
        "Inputs",
        "Selection",
        "Navigation",
        "Feedback",
        "Dialogs & Overlays",
        "Data Display",
        "Media",
        "Layout",
        "Forms",
        "Lists",
        "Tables",
        "Authentication",
        "Commerce",
        "Communication",
        "File",
        "Maps",
        "Charts",
        "Utilities",
        "Mobile",
        "AI",
        "Korean Service",
        "Foundation"
      ],
      "description": "기능 축 — 컴포넌트가 '무엇을 위한 것인가'. level(원자성 축)과 직교한다. Storybook 사이드바 그룹과 Figma 페이지 분류에 쓴다. 이 enum 의 나열 순서가 표시 순서의 정본이며 tools/codegen/src/shared.ts 의 CATEGORY_ORDER 와 일치해야 한다."
    },
    "taxonomyItem": {
      "type": "string",
      "pattern": "^[a-z0-9]+(-[a-z0-9]+)*$",
      "description": "이 컴포넌트가 구현하는 정본 카탈로그 항목 key (contracts/taxonomy.v1.json 의 해당 category 안 items[].key). 생략하면 '정본 목록 밖 프로젝트 고유 컴포넌트(extras)'로 분류된다. Storybook 카탈로그와 Figma 문서 체크리스트가 이 값으로 구현/미구현을 판정한다."
    },
    "status": { "enum": ["draft", "beta", "stable", "deprecated"] },
    "description": { "type": "string" },
    "summary": {
      "type": "string",
      "maxLength": 90,
      "description": "Figma 문서 카드의 제목 밑에 들어가는 **한 줄** 설명(한국어). 생략하면 codegen 이 description 의 첫 문장을 잘라 쓴다 — 문장이 길거나 대괄호 주석으로 시작하면 여기에 직접 적을 것."
    },
    "owner": {
      "type": "object",
      "description": "축별 소유 팀. code=React 구현, design=디자인 정의, figma=Figma 컴포넌트.",
      "required": ["code", "design", "figma"],
      "additionalProperties": false,
      "properties": {
        "code": { "$ref": "#/$defs/ownerTeam" },
        "design": { "$ref": "#/$defs/ownerTeam" },
        "figma": { "$ref": "#/$defs/ownerTeam" }
      }
    },
    "props": {
      "type": "object",
      "minProperties": 1,
      "propertyNames": { "pattern": "^[a-z][A-Za-z0-9]*$" },
      "additionalProperties": { "$ref": "#/$defs/prop" }
    },
    "events": {
      "type": "object",
      "propertyNames": {
        "pattern": "^on[A-Z][A-Za-z0-9]*$",
        "description": "이벤트는 on* 네이밍 강제 (G3 체크리스트)"
      },
      "additionalProperties": { "$ref": "#/$defs/event" }
    },
    "figmaStateAxis": {
      "type": "array",
      "items": { "type": "string" },
      "description": "Figma 에서 만들 상태 변형 축의 값 목록. states 의 부분집합이며, **시각적으로 실제 구분되는 상태만** 넣는다. 구분은 두 갈래로 생긴다: (1) variantTokens.state 에 그 상태의 토큰 덮어쓰기가 있거나, (2) anatomy 의 when 조건이 그 상태에서만 어떤 부위를 그린다(예: loading 의 스피너). 어느 쪽도 아니면 넣지 않는다 — 픽셀이 같은 변형을 만드는 것은 커버리지가 아니라 소음이고, 디자이너가 '이 둘은 뭐가 다른가' 를 묻게 만든다(아이콘 11종이 전부 같은 글리프로 보이던 것과 같은 종류의 결함이다). 이 축을 선언한 계약에서는 축 값과 같은 이름의 boolean prop(disabled·loading)이 Figma BOOLEAN 으로 중복 생성되지 않는다 — 두 축이 공존하면 Disabled=true + State=hover 같은 모순 조합이 표현 가능해지기 때문이다. React 타입은 바뀌지 않는다.",
      "examples": [["default", "hover", "active", "disabled", "loading"]]
    },
    "states": {
      "type": "array",
      "minItems": 1,
      "uniqueItems": true,
      "items": {
        "enum": [
          "default",
          "hover",
          "active",
          "focus-visible",
          "disabled",
          "loading",
          "error",
          "readonly",
          "selected",
          "checked",
          "indeterminate",
          "open",
          "closed"
        ]
      }
    },
    "tokens": {
      "type": "object",
      "minProperties": 1,
      "description": "시각 속성 → 토큰 참조 매핑. 하드코딩 값 금지 — 값은 반드시 tokens.json 내 존재하는 경로. 변형과 무관한 값(공통 radius·gap 등)과 기본 변형의 값이 여기 온다",
      "additionalProperties": {
        "type": "string",
        "pattern": "^[a-z][a-z0-9-]*(\\.[a-z0-9-]+)+$"
      }
    },
    "variantTokens": {
      "type": "object",
      "description": "변형 축별 토큰 매핑 — `계약 prop 이름 → 그 prop 의 값 → (tokens 와 같은) 키 → 토큰 경로`. 예: variantTokens.variant.danger.background. 플러그인은 활성 변형에 대해 이 표를 **flat tokens 보다 먼저** 조회하므로, 여기 선언된 키가 그 변형에서 flat tokens 를 덮어쓴다. 선언하지 않은 키는 flat tokens 로 떨어진다 — 변형별로 달라지지 않는 값은 여기 적지 않는다.",
      "additionalProperties": {
        "type": "object",
        "description": "이 prop 의 값 → 토큰 맵. 키는 props 에 선언된 enum 값이어야 한다",
        "minProperties": 1,
        "additionalProperties": {
          "type": "object",
          "minProperties": 1,
          "additionalProperties": {
            "type": "string",
            "pattern": "^[a-z][a-z0-9-]*(\\.[a-z0-9-]+)+$"
          }
        }
      }
    },
    "a11y": {
      "type": "object",
      "required": ["role", "keyboard", "focusVisible"],
      "properties": {
        "role": { "type": "string" },
        "keyboard": { "type": "array", "items": { "type": "string" }, "minItems": 1 },
        "focusVisible": { "type": "boolean" },
        "ariaDisabled": { "type": "string" },
        "ariaBusy": { "type": "string" },
        "aria": { "type": "object", "additionalProperties": { "type": "string" } },
        "contrastMin": { "type": "number", "minimum": 3 }
      },
      "additionalProperties": false
    },
    "responsive": {
      "type": "object",
      "required": ["breakpoints", "behavior"],
      "additionalProperties": false,
      "properties": {
        "breakpoints": {
          "type": "array",
          "items": { "enum": ["sm", "md", "lg", "xl"] },
          "minItems": 1,
          "uniqueItems": true
        },
        "behavior": { "enum": ["size-fixed", "fluid", "stack", "hide", "collapse"] }
      }
    },
    "compat": {
      "type": "object",
      "additionalProperties": false,
      "properties": {
        "breakingSince": { "type": ["string", "null"] },
        "deprecatedProps": {
          "type": "array",
          "items": {
            "type": "object",
            "required": ["name", "replacedBy", "removeIn"],
            "additionalProperties": false,
            "properties": {
              "name": { "type": "string" },
              "replacedBy": { "type": "string" },
              "removeIn": {
                "type": "string",
                "pattern": "^(0|[1-9]\\d*)\\.(0|[1-9]\\d*)\\.(0|[1-9]\\d*)$"
              }
            }
          }
        }
      }
    },
    "dependencies": {
      "type": "array",
      "description": "이 컴포넌트가 조립에 사용하는 하위 컴포넌트명 목록. atom은 빈 배열이어야 함 (레이어 역방향 의존 검출용)",
      "items": { "type": "string", "pattern": "^[A-Z][A-Za-z0-9]*$" },
      "uniqueItems": true
    },
    "anatomy": {
      "$ref": "#/$defs/anatomyNode",
      "description": "이 컴포넌트가 어떤 부위로 이루어지는지의 선언. Figma 플러그인이 이 트리를 그대로 실제 노드(오토레이아웃 프레임·텍스트·도형)로 만든다 — 스크린샷 이미지를 쓰지 않는다. 생략하면 플러그인이 tokens 키 이름에서 부위를 역산한다(deriveAnatomy). styles.* 의 값은 토큰 경로가 아니라 이 계약 tokens 블록의 **키**다."
    }
  },
  "$defs": {
    "anatomyNode": {
      "type": "object",
      "required": ["kind", "name"],
      "additionalProperties": false,
      "properties": {
        "kind": {
          "enum": ["frame", "text", "ellipse", "line", "instance", "vector"],
          "description": "Figma 노드 종류. frame=오토레이아웃 컨테이너, text=텍스트, ellipse/line=도형, instance=INSTANCE_SWAP 속성이 붙는 슬롯 자리, vector=실제 벡터 도형(SVG 에서 생성)"
        },
        "name": {
          "type": "string",
          "minLength": 1,
          "description": "레이어 이름 — 디자이너가 Figma 레이어 패널에서 보는 이름"
        },
        "layout": { "enum": ["NONE", "HORIZONTAL", "VERTICAL"] },
        "justify": { "enum": ["MIN", "CENTER", "MAX", "SPACE_BETWEEN"] },
        "align": { "enum": ["MIN", "CENTER", "MAX", "BASELINE"] },
        "wrap": { "type": "boolean" },
        "grow": { "type": "boolean", "description": "부모 주축을 채운다 (layoutGrow=1)" },
        "text": {
          "type": "string",
          "description": "kind=text 의 표본 문구. 생략하면 name 을 쓴다"
        },
        "svgIcon": {
          "type": "string",
          "description": "kind=vector 전용. **고정 아이콘** 하나를 이름으로 지정한다(예: 'close', 'chevron-left'). 값 집합은 Icon 계약의 name enum 과 같고, 실제 SVG 는 codegen 이 앱·DS 구현에서 추출한다 — 계약에 path 를 손으로 적지 않는다. 왜 필요한가: '×' '‹' '›' 같은 기호를 텍스트 레이어로 넣으면 Figma 가 글리프를 가진 다른 폰트로 **런타임 폴백**하고, 그 폰트가 미로드면 그 노드의 모든 쓰기가 터진다(이번 세션 폰트 크래시의 근원). 기호는 글자가 아니라 도형이므로 벡터로 그리는 것이 옳다. prop 값에 따라 모양이 갈리는 경우에는 svgFrom 을 쓴다.",
          "minLength": 1
        },
        "svgFrom": {
          "type": "string",
          "description": "kind=vector 전용. 이 부위의 벡터 모양을 어느 prop 값으로 고르는지 나타내는 계약 prop 이름이다(예: 'name'). codegen 이 그 prop 의 값마다 실제 SVG 를 추출해 산출물의 assets 표에 넣고, 플러그인이 변형마다 해당 SVG 로 진짜 벡터 노드를 만든다. 모양의 정본은 앱·DS 의 실제 아이콘 구현이며 계약에 SVG 를 손으로 적지 않는다 — 두 벌이 되면 다음에 어긋난다."
        },
        "figmaToggle": {
          "type": "boolean",
          "description": "kind=text 전용 옵트인(figmaText 와 함께 쓴다). true 면 이 레이어를 켜고 끄는 Figma BOOLEAN 속성을 하나 더 만든다. **그 요소가 없는 형태가 실제로 존재하는 라벨에만** 붙인다(카운터·부가 설명·보조 액션처럼). 버튼의 유일한 라벨처럼 끄면 컴포넌트가 무의미해지는 것에는 붙이지 않는다. React 타입은 바뀌지 않는다.",
          "default": false
        },
        "figmaText": {
          "type": "boolean",
          "description": "kind=text 전용 옵트인. true 면 이 레이어를 Figma TEXT 컴포넌트 속성으로 노출해 디자이너가 인스턴스에서 글자를 고칠 수 있게 한다. 기본값은 anatomy 의 표본 문구를 승계한다. 왜 계약 prop 이 아니라 이 플래그인가: 이 문구들은 React 에서 prop 이 아니라 컴포넌트가 그리는 **고정 라벨**이다(카운터 '128/500', 구분자, 안내 문구 등). 계약 prop 으로 올리면 코드에 없는 prop 이 생기고 React 컴포넌트가 줄줄이 오염된다. React 와 Figma 는 '부재'와 '고정값'을 다르게 다루므로 Figma 표현만 바꾸는 플래그가 옳다 — figmaVariant·figmaToggle 과 같은 계열이다. React 타입·prop·스토리는 바뀌지 않는다. repeat 안의 레이어에는 쓰지 않는다(회차가 한 속성을 공유해 버려 samples 로 만든 차이가 사라진다).",
          "default": false
        },
        "samples": {
          "type": "array",
          "items": { "type": "string" },
          "description": "kind=text 전용. 반복(repeat) 안에서 회차마다 다른 표본 문구. 왜 필요한가: repeat 은 같은 부위를 N번 그리는데 표본이 하나뿐이면 N개가 전부 같은 글자로 나온다 — 실제 Figma 에서 RichTextField 툴바가 'B' 여덟 개로, 탭이 '대시보드' 네 개로, 페이지 번호가 '1' 다섯 개로 보인 원인이다. 회차 수보다 짧으면 순환하고, 없으면 text 를 그대로 쓴다."
        },
        "uniformRepeat": {
          "type": "boolean",
          "description": "이 반복은 회차가 전부 같은 것이 옳다는 선언(예: 갤러리 타일마다 붙는 동일한 삭제 버튼, 차트의 격자선). 기본은 '회차마다 달라야 한다' 이며, 같으면 렌더 품질 게이트가 막는다.",
          "default": false
        },
        "textProp": {
          "type": "string",
          "description": "이 텍스트를 공급하는 계약 prop 이름(node/string). Figma TEXT 컴포넌트 속성이 이 레이어의 characters 에 연결된다"
        },
        "slotProp": {
          "type": "string",
          "description": "이 자리를 채우는 계약 slot prop 이름. INSTANCE_SWAP 속성이 연결된다"
        },
        "visibleProp": {
          "type": "string",
          "description": "이 부위의 표시 여부를 제어하는 계약 boolean prop. BOOLEAN 속성이 visible 에 연결된다"
        },
        "fixedWidth": { "type": "number", "description": "토큰이 없는 순수 레이아웃 치수(px)" },
        "fixedHeight": { "type": "number", "description": "토큰이 없는 순수 레이아웃 치수(px)" },
        "repeat": {
          "type": "integer",
          "minimum": 2,
          "maximum": 12,
          "description": "이 부위를 N번 반복한다 (표의 행, 리스트 아이템 등)"
        },
        "when": {
          "type": "object",
          "required": ["prop", "equals"],
          "additionalProperties": false,
          "description": "이 부위가 특정 변형에서만 나타날 때의 조건",
          "properties": {
            "prop": { "type": "string" },
            "equals": { "type": "array", "items": { "type": "string" }, "minItems": 1 }
          }
        },
        "styles": { "$ref": "#/$defs/anatomyStyles" },
        "children": {
          "type": "array",
          "items": { "$ref": "#/$defs/anatomyNode" },
          "minItems": 1
        }
      }
    },
    "anatomyStyles": {
      "type": "object",
      "additionalProperties": false,
      "description": "부위 하나의 스타일. **값은 전부 이 계약 tokens 블록의 키**이며 Figma Variable 로 바인딩된다. 변형별 키(surfaceDanger 등)는 플러그인이 활성 변형 값으로 자동 선택하므로 기본 키(surface)만 적으면 된다.",
      "properties": {
        "fill": { "type": "string", "description": "배경색 — fills" },
        "stroke": { "type": "string", "description": "테두리색 — strokes" },
        "strokeWidth": { "type": "string", "description": "테두리 두께 — strokeWeight" },
        "radius": { "type": "string", "description": "모서리 — 4코너 radius" },
        "padX": { "type": "string", "description": "좌우 패딩" },
        "padY": { "type": "string", "description": "상하 패딩" },
        "pad": { "type": "string", "description": "4방 패딩 (padX/padY 가 우선)" },
        "gap": { "type": "string", "description": "자식 간격 — itemSpacing" },
        "color": { "type": "string", "description": "글자색 — text 노드의 fills" },
        "typography": {
          "type": "string",
          "description": "합성 타이포 토큰 키 — font-size/font-weight 서브 Variable 로 전개된다"
        },
        "fontSize": {
          "type": "string",
          "description": "글자 크기만 따로 지정하는 dimension 토큰 키. typography 합성 토큰의 font-size 보다 **우선**한다 — 크기 축(sm·md·lg)이 font-size 만 바꾸고 weight/line-height 는 유지하는 경우(Button)를 합성 토큰 교체 없이 표현한다"
        },
        "size": { "type": "string", "description": "정사각 크기 — width+height 동시 지정" },
        "minHeight": { "type": "string" },
        "width": { "type": "string" }
      }
    },
    "ownerTeam": {
      "type": "string",
      "pattern": "^[a-z][a-z0-9-]*$",
      "description": "소유 팀 슬러그 (kebab-case)"
    },
    "prop": {
      "type": "object",
      "required": ["type"],
      "additionalProperties": false,
      "properties": {
        "type": {
          "enum": [
            "enum",
            "boolean",
            "string",
            "number",
            "slot",
            "node",
            "function",
            "array",
            "object"
          ],
          "description": "array/object 는 데이터 기반 컴포넌트(테이블 rows, 차트 points 등)의 데이터 prop 이다. Figma Component Property 대응이 없으므로 figmaProperty 를 요구하지 않으며, itemShape 로 TS 타입을 기술한다 (ADR-0003)."
        },
        "values": {
          "type": "array",
          "items": { "type": "string", "pattern": "^[a-z][a-z0-9-]*$" },
          "minItems": 2,
          "uniqueItems": true
        },
        "default": {},
        "required": { "type": "boolean", "default": false },
        "figmaProperty": {
          "type": "string",
          "description": "Figma Component Property 매핑명. enum/boolean prop은 필수 (G3 체크리스트)"
        },
        "figmaToggle": {
          "type": "boolean",
          "description": "slot prop 전용 옵트인. true 면 Figma 에서 INSTANCE_SWAP 속성과 함께 그 슬롯 레이어의 표시/숨김을 제어하는 BOOLEAN 속성을 하나 더 만든다(이름 규약: 계약 prop 이 iconLeft 면 BOOLEAN 의 계약 키는 iconLeftVisible, Figma 표시명은 'Show Icon Left'). 왜 필요한가: React 는 슬롯에 아무것도 넘기지 않으면 그냥 렌더하지 않아 '없음'을 표현할 prop 이 따로 필요 없지만, Figma 의 INSTANCE_SWAP 레이어는 항상 존재하므로 디자이너가 아이콘을 끄려면 visible 에 묶인 BOOLEAN 이 있어야 한다. React 타입은 바뀌지 않는다 — figmaVariant 과 같이 Figma 표현만 바꾸는 플래그다.",
          "default": false
        },
        "figmaVariant": {
          "type": "boolean",
          "description": "boolean prop 전용 옵트인. true 면 Figma 에서 BOOLEAN 컴포넌트 속성이 아니라 **Variant 축(true/false)** 으로 만든다.\n\n[언제 켜나] 그 boolean 이 레이어의 표시 여부가 아니라 **내용 자체**를 가르는 경우다. Figma 의 BOOLEAN→visible 바인딩에는 부정(NOT)이 없어, '켜짐이면 A, 꺼짐이면 B' 를 두 레이어의 visible 로 표현할 수 없다 — 두 레이어가 같은 속성을 보면 함께 켜지고 함께 꺼진다. Variant 축으로 만들면 anatomy 의 when 조건이 각 레이어를 해당 상태에서만 그린다.\n\nReact 타입은 그대로 boolean 이다 — 이 플래그는 Figma 표현만 바꾼다.",
          "default": false
        },
        "accepts": { "type": "array", "items": { "type": "string" }, "minItems": 1 },
        "itemShape": {
          "type": "string",
          "description": "array/object prop 의 TS 타입 표현 (예: \"{ id: string; label: string }\"). codegen 이 생성 타입에 그대로 박는다."
        },
        "hiddenWhen": { "type": "array", "items": { "type": "string" } },
        "description": { "type": "string" },
        "summary": {
          "type": "string",
          "maxLength": 90,
          "description": "Figma 문서에서 이 prop 섹션 헤더 밑에 붙는 **한 줄** 설명(한국어). 생략하면 codegen 이 description 의 첫 문장을 잘라 쓴다."
        },
        "deprecated": { "type": "boolean" }
      },
      "allOf": [
        {
          "if": { "properties": { "type": { "const": "enum" } }, "required": ["type"] },
          "then": { "required": ["values", "figmaProperty"] }
        },
        {
          "if": { "properties": { "type": { "const": "boolean" } }, "required": ["type"] },
          "then": { "required": ["figmaProperty"] }
        },
        {
          "if": { "properties": { "type": { "const": "slot" } }, "required": ["type"] },
          "then": { "required": ["accepts"] }
        },
        {
          "if": { "properties": { "type": { "enum": ["array", "object"] } }, "required": ["type"] },
          "then": { "required": ["itemShape"] }
        },
        {
          "anyOf": [
            { "required": ["default"] },
            { "properties": { "required": { "const": true } }, "required": ["required"] }
          ],
          "$comment": "G3 규칙: 모든 prop은 default가 있거나 required:true여야 한다"
        }
      ]
    },
    "event": {
      "type": "object",
      "required": ["payload"],
      "additionalProperties": false,
      "properties": {
        "payload": {
          "type": "string",
          "description": "TS 타입명 (예: MouseEvent, ChangeEvent<HTMLInputElement>)"
        },
        "blockedWhen": {
          "type": "array",
          "items": { "type": "string" },
          "description": "이벤트 발화가 차단되는 상태 목록. Storybook Play Function이 전수 검증"
        },
        "description": { "type": "string" }
      }
    }
  }
}
