{
  "$schema": "https://tds.internal/schemas/component.v1.json",
  "name": "IconButton",
  "version": "1.0.0",
  "level": "atom",
  "category": "Actions",
  "taxonomyItem": "icon-button",
  "status": "beta",
  "summary": "글리프 하나만 담는 정사각 버튼 — 툴바·행 손잡이의 최소 액션",
  "description": "아이콘만 보이는 정사각 버튼. 출처는 창작이 아니라 **두 벌의 수제 구현을 합친 것**이다: 이메일 빌더(apps/admin/.../email/styles.ts 의 `iconButtonStyle`)와 문자·알림톡 편집기(.../components/EditorToolbar.tsx:74 의 비공개 `function IconButton`). 두 화면 모두 var(--tds-*) 토큰은 옳게 썼으나 컴포넌트가 없어 값이 파일마다 갈라졌다 — 크기(space.7 vs space.6) · 포커스 클래스 유무 · title 속성 유무가 실제로 어긋나 있었다. 이 계약은 그 차이를 '누가 옳은가' 로 판정하지 않고 **축으로 승격**한다: 크기는 size prop 이 되고, 포커스 링과 title 은 둘 중 강한 쪽(있는 쪽)을 정본으로 삼는다.\n\n[label 이 required 인 이유] 아이콘만 보이므로 접근 가능한 이름을 공급할 것이 다른 데 없다. 비면 스크린리더에 '버튼' 이라고만 읽힌다. 그래서 선택이 아니라 필수이며, 같은 문자열이 `aria-label` 과 `title`(마우스 툴팁) 양쪽에 들어간다 — 문자 편집기 쪽이 하던 것이고, 이메일 쪽에는 없어 마우스 사용자가 아이콘의 뜻을 알 길이 없었다.\n\n[pressed 가 boolean 이 아니라 3값 enum 인 이유] `aria-pressed` 는 세 상태를 갖는다: 없음(일반 액션) · true · false. 실행취소·다시하기 같은 일반 액션에 `aria-pressed=\"false\"` 를 달면 **거짓 시맨틱**이다 — 스크린리더가 '토글 버튼, 안 눌림' 이라고 읽어 사용자가 누르면 무언가 켜질 것이라 기대하게 된다. 문자 편집기의 수제 구현은 이 함정을 이미 알고 있었고(`EditorToolbar.tsx:84` 주석과 `:96` 의 조건부 spread) 같은 규칙을 여기서도 지킨다. 계약이 boolean 을 optional 로 표현할 수단이 없어(boolean 은 default 와 figmaProperty 를 요구하고, default 를 주면 속성이 항상 나간다) **부재를 값으로 올린 것이 `unset`** 이다.\n\n[왜 별도의 ToggleButton 을 만들지 않았나] 두 툴바의 토글은 전부 '눌릴 수 있는 아이콘 버튼' 이고, 눌림 여부만 다른 컴포넌트를 하나 더 만들면 CSS 가 두 벌이 되어 이 계약이 없애려던 표류가 그대로 되살아난다. 글자 라벨이 붙는 토글(문자 편집기의 '치환변수' 알약, `EditorToolbar.tsx:157`)은 Button 이 이미 덮는다 — Button 계약의 네이티브 속성 패스스루가 `aria-pressed` 를 그대로 흘린다. 상호배타 묶음(캔버스 폭 데스크톱/모바일)은 SegmentedControl 의 영역이다. 분류표 `toggle-button` 키를 비워 둔 판단 근거는 docs/audit 의 인수인계를 참조한다 — `loading` 키 선례와 같다.\n\n[네이티브 속성 패스스루] 계약 props 외의 표준 HTML/ARIA 속성(aria-expanded · aria-haspopup · aria-controls · title …)은 <button> 으로 그대로 전달한다 (Card·Button 선례). className/style 은 토큰 규칙 보호를 위해 차단한다. 이 패스스루가 있어야 변수 드롭다운 트리거처럼 `aria-expanded`/`aria-haspopup` 이 필요한 자리를 계약 prop 을 늘리지 않고 표현할 수 있다.",
  "owner": {
    "code": "component-eng",
    "design": "ui-design",
    "figma": "figma-eng"
  },
  "props": {
    "icon": {
      "type": "slot",
      "accepts": ["Icon"],
      "required": true,
      "summary": "버튼이 담는 유일한 글리프 — Figma 에서는 INSTANCE_SWAP 으로 고른다",
      "description": "표시할 글리프. 버튼의 유일한 내용이므로 required 다 — 비면 빈 사각형이 된다. 구현은 이 슬롯을 `aria-hidden` 래퍼에 담는다: 접근 가능한 이름은 label 이 소유하고, 아이콘이 이름을 오염시키면 안 된다. Figma 에서는 아이콘 종류를 INSTANCE_SWAP 으로 59종 중에서 고른다"
    },
    "label": {
      "type": "string",
      "required": true,
      "summary": "접근 가능한 이름 — aria-label 과 title 에 함께 들어간다",
      "description": "이 버튼이 무엇을 하는지의 문구(예: '되돌리기'). 아이콘만 보이므로 이름을 공급할 것이 이것뿐이라 required 다. 같은 값이 `aria-label`(스크린리더)과 `title`(마우스 툴팁) 양쪽에 들어간다 — 두 사용자 집단이 같은 정보를 얻어야 하고, 값이 하나이므로 갈라질 수 없다"
    },
    "size": {
      "type": "enum",
      "values": ["sm", "md"],
      "default": "md",
      "figmaProperty": "Size",
      "summary": "정사각 변 길이. sm=space.6 · md=space.7 — 실재하던 두 크기다",
      "description": "정사각 변의 길이. 두 값 모두 실물에서 온 것이다: md 는 이메일 빌더의 space.7, sm 은 문자·알림톡 편집기의 space.6. 어느 한쪽을 틀렸다고 판정할 근거가 없어(둘 다 오너 확정 화면이다) 축으로 올렸다. 기본값 md 는 파일럿 소비자(이메일 빌더)의 현행 시각을 유지하기 위한 것이며, 시각 회귀 없이 이관하려는 화면은 자기 값을 명시한다"
    },
    "pressed": {
      "type": "enum",
      "values": ["unset", "on", "off"],
      "default": "unset",
      "figmaProperty": "Pressed",
      "summary": "토글 상태. unset 이면 aria-pressed 를 아예 내지 않는다",
      "description": "토글 여부와 그 상태. `unset`(기본)이면 `aria-pressed` 속성을 **내지 않는다** — 실행취소처럼 상태가 없는 일반 액션이다. `on`/`off` 는 각각 `aria-pressed=\"true\"`/`\"false\"` 를 낸다. 세 값을 둔 이유는 `off` 와 `unset` 이 접근성상 전혀 다른 말이기 때문이다: 전자는 '꺼진 토글', 후자는 '토글이 아님'. 시각은 `on` 에서만 달라지고 `off` 와 `unset` 은 같다 — 스타일은 `aria-pressed` 속성 셀렉터가 소유하므로 접근성 상태와 픽셀이 구조적으로 갈라질 수 없다"
    },
    "disabled": {
      "type": "boolean",
      "default": false,
      "figmaProperty": "Disabled",
      "summary": "비활성 — onClick 차단 + 네이티브 disabled",
      "description": "비활성. 네이티브 `disabled` 를 걸어 포커스 순서에서 빼고 onClick 을 차단한다. 툴바에서는 되돌릴 이력이 없을 때(canUndo=false) 등에 쓴다"
    }
  },
  "events": {
    "onClick": {
      "payload": "MouseEvent",
      "blockedWhen": ["disabled"],
      "description": "disabled 상태에서는 발화 금지"
    }
  },
  "states": ["default", "hover", "active", "focus-visible", "disabled", "selected"],
  "tokens": {
    "size": "space.7",
    "radius": "radius.sm",
    "background": "color.transparent",
    "border": "color.transparent",
    "borderWidth": "border-width.thin",
    "text": "color.text.default",
    "backgroundHover": "color.surface.raised",
    "textDisabled": "color.text.disabled",
    "focusRing": "color.border.focus",
    "focusRingWidth": "border-width.medium",
    "focusRingOffset": "space.1",
    "transitionDuration": "motion.duration.fast",
    "transitionEasing": "motion.easing.standard"
  },
  "variantTokens": {
    "size": {
      "sm": {
        "size": "space.6"
      },
      "md": {
        "size": "space.7"
      }
    },
    "pressed": {
      "unset": {
        "background": "color.transparent",
        "border": "color.transparent",
        "text": "color.text.default"
      },
      "off": {
        "background": "color.transparent",
        "border": "color.transparent",
        "text": "color.text.default"
      },
      "on": {
        "background": "color.surface.raised",
        "border": "color.action.primary.default",
        "text": "color.action.primary.default"
      }
    }
  },
  "a11y": {
    "role": "button",
    "keyboard": [
      "Tab — 포커스 진입. disabled 면 순서에서 빠진다",
      "Enter · Space — 활성화. 네이티브 <button> 이 click 으로 바꿔 주므로 별도 처리가 없다"
    ],
    "focusVisible": true,
    "ariaDisabled": "쓰지 않는다 — 네이티브 disabled 를 건다. 툴바 버튼은 비활성일 때 포커스 순서에 남을 이유가 없다(메뉴 항목과 다르다)",
    "aria": {
      "aria-label": "label prop 이 항상 공급한다. 아이콘만 보이므로 이름의 유일한 원천이다",
      "aria-pressed": "pressed 가 on/off 일 때만 낸다. unset 에서 aria-pressed=\"false\" 를 내면 일반 액션이 토글로 낭독되는 거짓 시맨틱이 된다",
      "aria-hidden": "아이콘 슬롯 래퍼에 붙는다. 글리프가 접근 가능한 이름에 섞여 들어가지 않게 한다",
      "native-passthrough": "aria-expanded · aria-haspopup · aria-controls 등은 계약 prop 이 아니라 <button> 으로 그대로 흐른다 (Button 선례). 변수 드롭다운 트리거가 이것을 쓴다"
    },
    "contrastMin": 3
  },
  "responsive": {
    "breakpoints": ["sm", "md", "lg"],
    "behavior": "size-fixed"
  },
  "compat": {
    "breakingSince": null,
    "deprecatedProps": []
  },
  "dependencies": [],
  "anatomy": {
    "kind": "frame",
    "name": "IconButton",
    "layout": "HORIZONTAL",
    "justify": "CENTER",
    "align": "CENTER",
    "styles": {
      "fill": "background",
      "stroke": "border",
      "strokeWidth": "borderWidth",
      "radius": "radius",
      "size": "size"
    },
    "children": [
      {
        "kind": "instance",
        "name": "Icon",
        "slotProp": "icon"
      }
    ]
  }
}
