{
  "$schema": "https://tds.internal/schemas/component.v1.json",
  "name": "Toast",
  "version": "1.1.0",
  "level": "molecule",
  "category": "Feedback",
  "taxonomyItem": "toast",
  "status": "beta",
  "description": "토스트 1건 — 아이콘 + 문구 + (실패면) '다시 시도' + 닫기(×). 결과 통지의 시각 단위다. 큐/위치/최대 개수는 조립하는 쪽(ToastProvider)이 소유한다 (ADR-0003).\n\n[kind 가 톤·아이콘·라이브·자동소멸을 정한다] success=4초 자동소멸/status · cancelled=2초/status · info=4초/status · error=**자동소멸 없음**/alert. 실패를 조용히 삼키지 않기 위해 error 는 사용자가 닫거나 재시도할 때까지 남는다.\n\n[a11y — 1.1.0: 라이브 영역을 소유하지 않는다] 토스트는 동적으로 삽입되는 노드이고, **내용과 함께 생성된 라이브 영역은 스크린리더에서 신뢰성 있게 announce 되지 않는다**. 그래서 role/aria-live 를 Toast 에서 떼고, 토스트보다 먼저·항상 존재하는 ToastProvider 의 **지속 라이브 영역 2개**(비-error=polite · error=assertive)가 통지를 소유한다 (A11Y-01). Toast 는 시각 표현(tone·아이콘)과 자동소멸·닫기/재시도 배선만 담당한다. kind 는 여전히 **어느 라이브 영역으로 갈지**를 결정하며, 그 분배는 ToastProvider 가 수행한다. 닫기 버튼으로 키보드로 닫을 수 있다. 등장 모션은 prefers-reduced-motion 에서 꺼진다.\n\n[imperative props — 계약 밖 컴포넌트 경계] id(큐 키·onDismiss 인자)·onDismiss·onRetry 는 명령형 배선이라 Figma 대응이 없다. 계약 props(kind·message)는 디자인이 보는 표면만 기술한다 (Alert 와 동일 판정). onRetry 를 주면 '다시 시도' 버튼이 나타난다 — 별도 boolean 이 아니라 핸들러 유무로 결정한다 (Alert.onClose 선례).",
  "owner": {
    "code": "component-eng",
    "design": "ui-design",
    "figma": "figma-eng"
  },
  "props": {
    "kind": {
      "type": "enum",
      "values": ["success", "cancelled", "error", "info"],
      "default": "info",
      "figmaProperty": "Kind",
      "description": "토스트의 의미 — 톤(feedback 토큰)·아이콘·라이브 리전 시맨틱(error=alert/assertive · 그 외=status/polite)·자동소멸 시간(success/info 4초 · cancelled 2초 · error 없음)을 함께 결정한다"
    },
    "message": {
      "type": "string",
      "required": true,
      "description": "표시 문구. 아이콘 옆 <span> 으로 렌더된다"
    }
  },
  "events": {
    "onDismiss": {
      "payload": "string",
      "description": "토스트를 닫는다 — 자동소멸 타이머·닫기(×) 버튼·재시도 버튼이 이 토스트의 id 를 인자로 부른다. 큐에서 제거하는 것은 호출부(ToastProvider)의 책임이다"
    },
    "onRetry": {
      "payload": "void",
      "description": "**핸들러를 주면 '다시 시도' 버튼이 나타나고, 주지 않으면 나타나지 않는다** (해제 가능 여부가 아니라 복구 경로 유무를 핸들러로 표현 — Alert.onClose 선례). 누르면 이 토스트를 닫고(onDismiss) 재시도를 실행한다. 실패(error) 토스트에만 실제로 붙는다"
    }
  },
  "states": ["default"],
  "tokens": {
    "surfaceSuccess": "color.feedback.success.surface",
    "borderSuccess": "color.feedback.success.border",
    "textSuccess": "color.feedback.success.text",
    "surfaceInfo": "color.feedback.info.surface",
    "borderInfo": "color.feedback.info.border",
    "textInfo": "color.feedback.info.text",
    "surfaceDanger": "color.feedback.danger.surface",
    "borderDanger": "color.feedback.danger.border",
    "textDanger": "color.feedback.danger.text",
    "radius": "radius.md",
    "shadow": "shadow.overlay",
    "paddingX": "space.4",
    "paddingY": "space.3",
    "gap": "space.3",
    "focusRing": "color.border.focus",
    "typography": "typography.label.md",
    "motion": "motion.duration.normal"
  },
  "variantTokens": {
    "kind": {
      "success": {
        "surface": "color.feedback.success.surface",
        "border": "color.feedback.success.border",
        "text": "color.feedback.success.text"
      },
      "cancelled": {
        "surface": "color.feedback.info.surface",
        "border": "color.feedback.info.border",
        "text": "color.feedback.info.text"
      },
      "error": {
        "surface": "color.feedback.danger.surface",
        "border": "color.feedback.danger.border",
        "text": "color.feedback.danger.text"
      },
      "info": {
        "surface": "color.feedback.info.surface",
        "border": "color.feedback.info.border",
        "text": "color.feedback.info.text"
      }
    }
  },
  "a11y": {
    "role": "none",
    "keyboard": ["Tab", "Enter", "Space"],
    "focusVisible": true,
    "aria": {
      "role": "1.1.0 — Toast 자신은 ARIA role 을 갖지 않는다. 동적 삽입 노드의 라이브 영역은 스크린리더가 신뢰성 있게 읽지 않으므로, 통지는 ToastProvider 의 **지속 라이브 영역**이 소유한다 (A11Y-01). Toast 는 시각 표현 + 배선만 담당한다",
      "aria-live": "Toast 에 없다. ToastProvider 가 항상 마운트된 뷰포트에 라이브 영역 2개를 둔다 — 비-error(success/cancelled/info)는 polite(role=status), error 는 assertive. kind 가 어느 영역으로 갈지를 정하고 분배는 ToastProvider 가 한다",
      "close-button": "닫기(×) — aria-label=\"알림 닫기\". 아이콘만 있으므로 접근 가능한 이름을 aria-label 로 준다",
      "reduced-motion": "등장 모션은 prefers-reduced-motion: reduce 에서 꺼진다"
    },
    "contrastMin": 4.5
  },
  "responsive": {
    "breakpoints": ["sm", "md", "lg"],
    "behavior": "fluid"
  },
  "compat": {
    "breakingSince": null,
    "deprecatedProps": []
  },
  "dependencies": [],
  "anatomy": {
    "kind": "frame",
    "name": "Toast",
    "layout": "HORIZONTAL",
    "align": "CENTER",
    "styles": {
      "fill": "surface",
      "stroke": "border",
      "radius": "radius",
      "padX": "paddingX",
      "padY": "paddingY",
      "gap": "gap"
    },
    "children": [
      {
        "kind": "ellipse",
        "name": "Kind Icon",
        "fixedWidth": 20,
        "fixedHeight": 20,
        "styles": {
          "fill": "text"
        }
      },
      {
        "kind": "text",
        "name": "Message",
        "text": "저장되었습니다",
        "textProp": "message",
        "grow": true,
        "styles": {
          "color": "text",
          "typography": "typography"
        }
      },
      {
        "kind": "text",
        "name": "Retry",
        "text": "다시 시도",
        "styles": {
          "color": "text",
          "typography": "typography"
        },
        "figmaText": true,
        "figmaToggle": true
      },
      {
        "kind": "vector",
        "name": "Close",
        "styles": {
          "color": "text",
          "typography": "typography"
        },
        "svgIcon": "close",
        "fixedWidth": 16,
        "fixedHeight": 16
      }
    ]
  }
}
